{
  "authors": ["DarkCode LLC"],
  "category": "ai-tool",
  "description": "AI-specific security tools spanning both offensive capabilities (adversarial pattern generators, prompt injection frameworks, model extraction tools) and defensive capabilities (AI model scanners, AIBOM generators, LLM firewalls).",
  "name": "VantaCode AI Tools",
  "source": "https://github.com/vantacode/vantacode-taxonomies",
  "type": "vantacode-ai-tools",
  "uuid": "66bdfd47-bb2c-4f23-9ebf-a8cdbd9dbdd4",
  "version": 1,
  "values": []
}
